{
  "$schema": "./config.schema.json",
  "servers": [
    {
      "name": "test-server",
      "transport": "stdio",
      "command": "echo",
      "args": [
        "test"
      ],
      "enabled": true
    }
  ],
  "gateway": {
    "port": 54269,
    "host": "127.0.0.1"
  },
  "auth": {
    "mode": "dev"
  },
  "policies": {
    "defaultTimeout": 30000
  }
}